{
  "$schema": "https://json-schema.org/draft/2020-12/schema",
  "title": "RichTextText",
  "customBasePath": "jsondoc.models.block.types.rich_text.base.RichTextBase",
  "type": "object",
  "properties": {
    "type": {
      "type": "string",
      "const": "text",
      "default": "text"
    },
    "text": {
      "type": "object",
      "properties": {
        "content": {
          "type": "string"
        },
        "link": {
          "type": ["object", "null"],
          "properties": {
            "url": {
              "type": "string"
            }
          },
          "required": ["url"]
        }
      },
      "required": ["content", "link"]
    },
    "annotations": {
      "$ref": "/shared_definitions/shared_definitions_schema.json#/$defs/annotations"
    },
    "plain_text": {
      "type": "string"
    },
    "href": {
      "type": ["string", "null"]
    }
  },
  "required": ["type", "text", "annotations", "plain_text", "href"],
  "unevaluatedProperties": false
}
